{
  "schema_version": "codex_delegated_action_request.v1",
  "workflow_id": "BOUNDED-EXECUTION-BACKLOG-107-001-STRUCTURED",
  "skill_id": "janus-executioner",
  "action_type": "propose_patch",
  "summary": "Capture bounded execution patch candidate for Codex review only.",
  "requires_codex_review": true,
  "non_goals": [
    "No auto apply",
    "No task completion claim"
  ],
  "action_payload": {
    "patch_format": "unified_diff",
    "allowed_files": [
      "scripts/dev-log-utils.cjs",
      "scripts/run-backend-dev.cjs",
      "scripts/run-vite-dev.cjs",
      "scripts/write-startup-marker.cjs",
      "package.json",
      "documentation/codex/skills/janus-health-check/scripts/health_snapshot.py",
      "documentation/codex/CODEX_DEV_ENVIRONMENT_RUNBOOK.md",
      ".gitignore",
      "documentation/test-runs/BACKLOG-107_execution_validation.md"
    ],
    "patch_text": "--- a/scripts/dev-log-utils.cjs\n+++ b/scripts/dev-log-utils.cjs\n@@ -10,7 +10,7 @@\n }\n \n function createLogStreams(prefix) {\n-  const logDir = path.join(process.cwd(), \"debug_logs\");\n+  const logDir = path.join(process.cwd(), \"documentation\", \"logs\", \"dev-runtime\");\n   ensureDir(logDir);\n   const stamp = timestampForFile();\n   const outPath = path.join(logDir, `${prefix}_${stamp}.out.log`);\n--- a/documentation/codex/skills/janus-health-check/scripts/health_snapshot.py\n+++ b/documentation/codex/skills/janus-health-check/scripts/health_snapshot.py\n@@ -37,18 +37,18 @@\n }\n \n KNOWN_ROOT_LEGACY_LOG_ARTIFACTS = {\n-    \".codex-vite-err.log\": \"legacy root Vite error log; current versioned dev start path writes Vite logs under debug_logs/\",\n-    \".codex-vite-out.log\": \"legacy root Vite output log; current versioned dev start path writes Vite logs under debug_logs/\",\n-    \"backend_hotfix.err.log\": \"legacy root backend helper log; current versioned backend dev/runtime logs belong under debug_logs/\",\n-    \"backend_hotfix.out.log\": \"legacy root backend helper log; current versioned backend dev/runtime logs belong under debug_logs/\",\n-    \"backend_live.err.log\": \"legacy root backend helper log; current versioned backend dev/runtime logs belong under debug_logs/\",\n-    \"backend_live.out.log\": \"legacy root backend helper log; current versioned backend dev/runtime logs belong under debug_logs/\",\n-    \"backend_persist.err.log\": \"legacy root backend helper log; current versioned backend dev/runtime logs belong under debug_logs/\",\n-    \"backend_persist.out.log\": \"legacy root backend helper log; current versioned backend dev/runtime logs belong under debug_logs/\",\n-    \"backend_restart.err.log\": \"legacy root backend helper log; current versioned backend dev/runtime logs belong under debug_logs/\",\n-    \"backend_restart.out.log\": \"legacy root backend helper log; current versioned backend dev/runtime logs belong under debug_logs/\",\n-    \"backend_start.log\": \"legacy root backend start log; current versioned backend dev/runtime logs belong under debug_logs/\",\n-    \"backend_start_manual.err.log\": \"legacy root backend helper log; current versioned backend dev/runtime logs belong under debug_logs/\",\n-    \"backend_start_manual.log\": \"legacy root backend helper log; current versioned backend dev/runtime logs belong under debug_logs/\",\n-    \"backend_verify.err.log\": \"legacy root backend helper log; current versioned backend dev/runtime logs belong under debug_logs/\",\n-    \"backend_verify.out.log\": \"legacy root backend helper log; current versioned backend dev/runtime logs belong under debug_logs/\",\n+    \".codex-vite-err.log\": \"legacy root Vite error log; current versioned dev start path writes Vite logs under documentation/logs/dev-runtime/\",\n+    \".codex-vite-out.log\": \"legacy root Vite output log; current versioned dev start path writes Vite logs under documentation/logs/dev-runtime/\",\n+    \"backend_hotfix.err.log\": \"legacy root backend helper log; current versioned backend dev/runtime logs belong under documentation/logs/dev-runtime/\",\n+    \"backend_hotfix.out.log\": \"legacy root backend helper log; current versioned backend dev/runtime logs belong under documentation/logs/dev-runtime/\",\n+    \"backend_live.err.log\": \"legacy root backend helper log; current versioned backend dev/runtime logs belong under documentation/logs/dev-runtime/\",\n+    \"backend_live.out.log\": \"legacy root backend helper log; current versioned backend dev/runtime logs belong under documentation/logs/dev-runtime/\",\n+    \"backend_persist.err.log\": \"legacy root backend helper log; current versioned backend dev/runtime logs belong under documentation/logs/dev-runtime/\",\n+    \"backend_persist.out.log\": \"legacy root backend helper log; current versioned backend dev/runtime logs belong under documentation/logs/dev-runtime/\",\n+    \"backend_restart.err.log\": \"legacy root backend helper log; current versioned backend dev/runtime logs belong under documentation/logs/dev-runtime/\",\n+    \"backend_restart.out.log\": \"legacy root backend helper log; current versioned backend dev/runtime logs belong under documentation/logs/dev-runtime/\",\n+    \"backend_start.log\": \"legacy root backend start log; current versioned backend dev/runtime logs belong under documentation/logs/dev-runtime/\",\n+    \"backend_start_manual.err.log\": \"legacy root backend helper log; current versioned backend dev/runtime logs belong under documentation/logs/dev-runtime/\",\n+    \"backend_start_manual.log\": \"legacy root backend helper log; current versioned backend dev/runtime logs belong under documentation/logs/dev-runtime/\",\n+    \"backend_verify.err.log\": \"legacy root backend helper log; current versioned backend dev/runtime logs belong under documentation/logs/dev-runtime/\",\n+    \"backend_verify.out.log\": \"legacy root backend helper log; current versioned backend dev/runtime logs belong under documentation/logs/dev-runtime/\",\n     \"startdev.log\": \"legacy root start-dev log; current versioned startup telemetry belongs under documentation/logs and dev runtime logs under debug_logs/\",\n-    \"tmp_uv8011_err.log\": \"legacy root temporary backend log; current versioned backend dev/runtime logs belong under debug_logs/\",\n-    \"tmp_uv8011_out.log\": \"legacy root temporary backend log; current versioned backend dev/runtime logs belong under debug_logs/\",\n+    \"tmp_uv8011_err.log\": \"legacy root temporary backend log; current versioned backend dev/runtime logs belong under documentation/logs/dev-runtime/\",\n+    \"tmp_uv8011_out.log\": \"legacy root temporary backend log; current versioned backend dev/runtime logs belong under documentation/logs/dev-runtime/\",\n }\n--- a/documentation/codex/CODEX_DEV_ENVIRONMENT_RUNBOOK.md\n+++ b/documentation/codex/CODEX_DEV_ENVIRONMENT_RUNBOOK.md\n@@ -49,14 +49,14 @@\n ## Local Runtime Logs\n \n - Local dev runtime logs for `npm run start-backend-only`,\n   `npm run start-backend-only-without-reload`, and `npm run start-vite`\n-  belong under `debug_logs/`.\n+  belong under `documentation/logs/dev-runtime/`.\n - Local startup telemetry markers and aggregated startup timing logs belong\n   under `documentation/logs/janus_startup_telemetry.log`.\n - Versioned dev start paths should not create recurring backend or Vite\n   runtime logs directly in the repository root.\n - Versioned startup telemetry paths should not write into ad-hoc folders such\n   as `documentation/Startup log`.\n - Historical root log artifacts are hygiene cleanup, not proof of the intended\n   target path.\n--- a/.gitignore\n+++ b/.gitignore\n@@ -25,3 +25,4 @@\n backend/backend/\n e2e_janus.db*\n playwright-report/data/\n playwright-report/trace/\n+documentation/logs/dev-runtime/\n--- a/documentation/test-runs/BACKLOG-107_execution_validation.md\n+++ b/documentation/test-runs/BACKLOG-107_execution_validation.md\n@@ -12,8 +12,8 @@\n - `python documentation/codex/skills/janus-health-check/scripts/health_snapshot.py --repo C:\\KI\\Janus-Projekt --mode MONTHLY` - PASS\n - Targeted code inspection confirmed:\n   - startup telemetry markers now target `documentation/logs/janus_startup_telemetry.log`\n-  - versioned backend/Vite dev-runtime logs still target `debug_logs/`\n+  - versioned backend/Vite dev-runtime logs now target `documentation/logs/dev-runtime/`\n   - known legacy root log files are reported under `root_legacy_log_artifacts`\n   - generic `root_suspicious` is empty for the current known recurring root-log family\n \n ## Manual Janus Evidence\n"
  }
}
